,review_date,review_rating,review_text,verified_purchase,review_time,review_textlength,helpful_review
1281,2/20/2019,5,"Surf Tropical Lily & Ylang Ylang is a fab laundry detergent  awesome smell, brilliant cleaning power  gets clothes bright clean, fresh even on cold washes. I love how it makes things smell, lasts for some time and great cleaning power on general stains like tea, deodorant marks, mud, spag bol so great for our family. Really easy to store, use and does. I have often rubbed a little into clothing if there is a particular stain like spag bol in case it needs a little more attention which works wonders even on whites! Really great value and having used it on delicate lingerie cottons, towels, silk dresses, man-made fiber clothing like work clothes, I have no complaints with general washing, highly recommend.",True,2019-02-20 07:51:00,715,4
1282,2/20/2019,4,Great softener and good Value at the price paid,True,2019-02-20 13:04:00,47,2
1283,2/21/2019,1,"I HATE HATE HATE the new pump. There seems to be no way to separate it from the bottle in order to get out the last of the lotion. Plus the new pump's opening is too big and clogs continually. If Vaseline does not fix this, I will have to find a new brand after 20 years of loyalty to this one. Shame on Vaseline for \""fixing\"" something that was never broken, all to get customers to purchase a new bottle sooner.",False,2019-02-21 17:26:00,414,0
1284,2/21/2019,5,I was asked to try this and have been using it for the past month. I usually just use body lotion occasionally on elbows knees etc. This one smells so nice and is easy to apply so I've used it every day. It goes on easily with very little residue and leaves a lovely smooth finish and scent. The bottle lasts for ages and is so good I will definitely be buying it in the future [This review was collected as part of a promotion.],False,2019-02-21 03:28:00,429,0
1285,2/21/2019,3,"I2019m happy this toner has no added fragrances to it. It is good for senstive skin yet still does the job! I2019m also happy that is contains witch hazel, something that is usually hard to find! The ingredients are simple and clear, and it does its job. Expecting good results from this product ! [This review was collected as part of a promotion.]",False,2019-02-21 02:56:00,349,2
1286,2/21/2019,4,This product is amazing makes my skin feel so toned and soft. I will be buying this product again. It gives my face a deep clean also I will defo recommend to my friends and family so they can also feel the benefits of this product. [This review was collected as part of a promotion.],False,2019-02-21 06:00:00,284,0
1287,2/21/2019,5,You can't go wrong with this product,True,2019-02-21 11:10:00,36,5
1288,2/21/2019,1,the comfort blues skies was missing when my order arrived as must of split as the box was soaked and smelt of conditioner and the box was open,True,2019-02-21 10:09:00,142,1
1289,2/26/2019,5,Item as stated and delivered on time. Also a good price,True,2019-02-26 14:06:00,55,2
1290,2/21/2019,5,as described,True,2019-02-21 07:04:00,12,2
1291,2/21/2019,5,A long standing family favourite. Decent ice cream with yummy bits in to suit everyones taste. A delicious sugary treat,False,2019-02-21 00:26:00,119,0
1292,2/21/2019,5,You can't go wrong with this product,True,2019-02-21 07:37:00,36,4
1293,2/21/2019,5,Ok,True,2019-02-21 15:53:00,2,0
1294,2/21/2019,5,"Beautiful smelling conditioner, although smaller bottles than I normally buy, but I will continue to buy, yes you could say its concentrated. However I have no drawers in my washing machine its a auto detergent and conditioner type depending on weight of washing load I definitely recommend",True,2019-02-21 09:35:00,292,4
1295,2/21/2019,5,"Brilliant price, happy with my purchase. Should last a while.",True,2019-02-21 07:46:00,61,5
1296,2/22/2019,5,"Since I have Combination/Oily skin, I have never found the perfect moisturiser - until now. I am quite particular in moisturisers that I don't like it when they leave a greasy feeling on my skin after I've applied it, they take ages to soak in or that they make me break out more. Thankfully, this one doesn't. My skin is more glowy and it definitely feels more hydrated and smooth since I started using this a few months ago. I loved it that much that I repurchased and it will be my go to moisturiser. I've seen many others like this but with a much higher price tag so a good find",False,2019-02-22 03:53:00,583,1
1297,2/22/2019,4,"This is a good toner for everyday use, use it morning/evening and makes my skin feel really fresh. Has no smell and very soft on the skin - not right for you if you want it to get rid of spots etc but for an everyday toner I would recommend. [This review was collected as part of a promotion.]",False,2019-02-22 13:05:00,293,0
1298,2/22/2019,5,This is the first toner that I have used in my skincare routine. I am really impressed with how well it cleans my skin and makes it feel really refreshed and clean. It is very gentle on my skin and has a very neutral scent.I would defiantly purchase this again afterwards. [This review was collected as part of a promotion.],False,2019-02-22 08:19:00,324,0
1299,2/22/2019,5,"Works well, it made a difference to my skin very quickly. It reduced my pores within a week and made my skin very smooth. Would highly recommend buying ! Cheaper than most products on the market so defiantly worth buying ! [This review was collected as part of a promotion.]",False,2019-02-22 10:04:00,274,0
1300,2/22/2019,4,"This toner is great for every skin type in my opinion. The product is in a plastic bottle which is very travel friendly. My only downside with this is that it's just a hole to pour out of and I often end up using too much. Good thing about it is that there is no alcohol in it at all! Also, no artificial perfumes or colours. Just natural, which is best for the skin. [This review was collected as part of a promotion.]",False,2019-02-22 04:01:00,419,5
1301,2/22/2019,5,I'm so happy I found something that works for my skin because I have combination skin so I have to be so careful about what I put on it. I am really happy with this facial wash because I sometimes come out in hives and this doesn't aggravate it at all. Go to for all skin types. [This review was collected as part of a promotion.],False,2019-02-22 02:10:00,330,3
1302,2/22/2019,5,"Brilliant price on subscribe and save, having it on constant order, one of the best shampoos ever. Definitely recommend this product. Especially on subscribe and save",True,2019-02-22 12:45:00,166,5
1303,2/22/2019,5,"Lovely fragrance, anti persdperant not just a body spray works too. On reorder, good value for money",True,2019-02-22 00:09:00,100,4
1304,2/22/2019,5,Nice smell and price is cheap!,True,2019-02-22 07:47:00,30,4
1305,2/22/2019,5,"Love this product, and more importantly the fantastic smells. I buy this shower gel all the time.",True,2019-02-22 09:55:00,97,2
1306,2/22/2019,5,I'm so happy I found something that works for my skin because I have combination skin so I have to be so careful about what I put on it. I am really happy with this facial wash because I sometimes come out in hives and this doesn't aggravate it at all. Go to for all skin types. [This review was collected as part of a promotion.],False,2019-02-22 19:56:00,330,0
1307,2/22/2019,5,This is the first toner that I have used in my skincare routine. I am really impressed with how well it cleans my skin and makes it feel really refreshed and clean. It is very gentle on my skin and has a very neutral scent.I would defiantly purchase this again afterwards. [This review was collected as part of a promotion.],False,2019-02-22 04:04:00,324,4
1308,2/22/2019,5,"Works well, it made a difference to my skin very quickly. It reduced my pores within a week and made my skin very smooth. Would highly recommend buying ! Cheaper than most products on the market so defiantly worth buying ! [This review was collected as part of a promotion.]",False,2019-02-22 00:38:00,274,2
1309,2/22/2019,4,"This toner is great for every skin type in my opinion. The product is in a plastic bottle which is very travel friendly. My only downside with this is that it's just a hole to pour out of and I often end up using too much. Good thing about it is that there is no alcohol in it at all! Also, no artificial perfumes or colours. Just natural, which is best for the skin. [This review was collected as part of a promotion.]",False,2019-02-22 03:24:00,419,0
1310,2/22/2019,4,"This is a good toner for everyday use, use it morning/evening and makes my skin feel really fresh. Has no smell and very soft on the skin - not right for you if you want it to get rid of spots etc but for an everyday toner I would recommend. [This review was collected as part of a promotion.]",False,2019-02-22 00:31:00,293,4
1311,2/22/2019,5,Kids and grown ups love this ice cream! Whats not to like?!,False,2019-02-22 07:36:00,59,1
1312,2/22/2019,4,Ben and Jerrys ice cream never fails to be a favourite and deliver on flavour.,False,2019-02-22 20:13:00,78,0
1313,2/22/2019,5,"This ice cream is so indulgent and is a fantastic treat, my son loves the addition of the chocolate fish which add a little bite.",False,2019-02-22 04:39:00,129,2
1314,2/22/2019,5,"This is yummy, only buy as a treat but so worth it.",False,2019-02-22 08:24:00,51,1
1315,2/22/2019,5,Good value,True,2019-02-22 21:04:00,10,0
1316,2/22/2019,5,"Brilliant price on subscribe and save, having it on constant order, one of the best shampoos ever. Definitely recommend this product. Especially on subscribe and save",True,2019-02-22 21:41:00,166,4
1317,2/22/2019,5,"Lovely fragrance, anti persdperant not just a body spray works too. On reorder, good value for money",True,2019-02-22 04:20:00,100,0
1318,2/22/2019,5,"Love this product, and more importantly the fantastic smells. I buy this shower gel all the time.",True,2019-02-22 01:53:00,97,5
1319,2/22/2019,5,Nice smell and price is cheap!,True,2019-02-22 04:29:00,30,2
1320,3/19/2019,5,Really good price,True,2019-03-19 08:24:00,17,2
1321,3/5/2019,5,Leaves clothes smelling lovely and feeling soft. Good price too.,True,2019-03-05 07:49:00,64,2
1322,3/5/2019,5,"Excellent product, price and service - couldn't fault it in any way",True,2019-03-05 11:48:00,67,1
1323,3/15/2019,5,Great bargain! Bottles seemed so tiny but you really don't need a lot for soft and beautifully scented clothes. Batgain,False,2019-03-15 17:30:00,119,0
1324,3/12/2019,5,Absolutely love this comfort love the smell love everything about it absolutely a fab all round ????????,True,2019-03-12 18:28:00,104,0
1325,3/11/2019,5,"My favourite conditioner, because I like the way it smells.",False,2019-03-11 04:40:00,59,2
1326,3/9/2019,4,"Love the fragrance of this item, came well packaged arrived promptly too",True,2019-03-09 07:14:00,72,5
1327,2/25/2019,5,Clothes smell lovely and fabric is beautiful and soft. The fresh smell lasts all day on my clothes.,True,2019-02-25 08:29:00,99,2
1328,2/22/2019,4,"My friend recommended it to me. After several washes, I hardly to see the difference by adding it. Good thing is there is plenty of it, many washes...",True,2019-02-22 22:23:00,150,4
1329,2/22/2019,4,Great washing capsules.,True,2019-02-22 15:48:00,23,4
1330,2/22/2019,4,Great washing capsules.,True,2019-02-22 04:03:00,23,3
1331,2/22/2019,4,Great washing capsules.,True,2019-02-22 13:06:00,23,0
1332,2/22/2019,4,Great washing capsules.,True,2019-02-22 10:14:00,23,0
1333,2/23/2019,3,"Great offer by Superdrug, however it looks like St Ives have changed the ingredients for this product as it is not as effective as I remember it being - in particular the texture, consistency and smell is very different. They need to bring back the old product!",False,2019-02-23 08:01:00,261,4
1334,3/12/2019,4,Leaves my severely damaged hair moisturised and fluffy. Couldn2019t ask for anymore considering the already amazing value for money and price.,False,2019-03-12 03:02:00,142,1
1335,2/26/2019,5,"I discovered this amazing product 2 years ago and since then it has become a staple of mine! I love how after usage the skin feels tanned enough, much softer and shimmery as well. Could not recommend it more!",False,2019-02-26 16:02:00,208,1
1336,3/14/2019,5,"Great product, it's the only moisturiser I use on my sensitive skin.",False,2019-03-14 14:24:00,68,0
1337,3/1/2019,5,I have eczema and acne rosacea on my face and I use this coz have very dry skin and other products sting my face and make it worse where as this it makes my skin nice and soft and is very effective and helps my eczema too.,False,2019-03-01 03:34:00,222,4
1338,2/23/2019,5,"So I have a oily combination skin type and I am forever getting spots and blackheads in my t-zone because of this, especially over my nose. Being fed up with it all I started to cleanse, tone and moisturise. This toner is by far the best one I have ever used. It smells amazing. It doesn2019t irritate my skin like some other brands I2019ve tried do (despite not having sensitive skin) and my blackheads and spots are clearing up. My oily t-zone isn2019t so much of a problem anymore. Definitely getting this from now on and recommending to anyone that has similar issues to me [This review was collected as part of a promotion.]",False,2019-02-23 04:27:00,629,1
1339,2/23/2019,5,"I2019ve been using this product for a few days now and I have to say that is really kind to skin.It doesn2019t had a bad smell,my skin feels so smooth and soft after using it.I truly recommend this product to everyone. [This review was collected as part of a promotion.]",False,2019-02-23 15:23:00,270,0
1340,2/25/2019,5,"This product is really surprising! It leaves my face looking and feeling so smooth, soft and fresh! Its a really gentle product and feels amazing when being massaged into wet skin. It rinses off without leaving and any residue and is fantastic value for money! I would certainly recommend this product as part of your every day skin care routine. [This review was collected as part of a promotion.]",False,2019-02-25 05:29:00,398,5
1341,3/16/2019,5,I always buy this product. It is really creamy and doesn't irritate my skin,False,2019-03-16 07:57:00,75,1
1342,2/25/2019,4,"Bought this for someone else while I was doing my shop, so can2019t personally comment on the use of it. They always use simple wash and face scrub, say it2019s doesn2019t dry out her skin.",False,2019-02-25 03:38:00,189,4
1343,3/2/2019,4,"Having sensitive skin it's usually difficult to find a facial wash that is effective, refreshing, gentle and doesn't dry out my skin. This ticked all those boxes and my skin was left feeling clean and fresh. I will definitely be buying this Simple product again. [This review was collected as part of a promotion.]",False,2019-03-02 02:53:00,314,3
1344,3/2/2019,5,"Suffering from mild Ezyema, my skin has always been sensitive and dry so i2019m very careful when using skincare products preferring brands who use no nasties. I2019ve been a fan of Simple for a while now, using their moisturisers and face wipes and have just switched to using their Kind to Skin face wash. 3 weeks in and i2019ve noticed my skin is more radiant and less dry than it has been, with my face left feeling clean and fresh after each wash. It2019s light, refreshing, non perfumed and best of all kind to skin but still cleansing. A great every day mild cleanser that you can introduce to your skin care regime. A great product at a very affordable price range. [This review was collected as part of a promotion.]",False,2019-03-02 03:43:00,725,3
1345,3/19/2019,4,"I bought this a few months ago due to the fact that I love Simple skincare products and was looking for a drugstore face wash that didn2019t have lots of nasties. This is the perfect gentle face wash after I take my makeup off, leaved my skin feeling very soft and clean, followed by Simple moisturiser and it2019s a no brainer. [This review was collected as part of a promotion.]",False,2019-03-19 05:53:00,380,2
1346,3/13/2019,4,"I really like this product, I use it in my double cleansing routine, after using oil to remove my makeup, this product helps removing all the rest. I feel that it really respect my acne prone skin and leaves it fresh and smooth. [This review was collected as part of a promotion.]",False,2019-03-13 13:32:00,280,0
1347,2/26/2019,5,I use to use shops own brand face wash which seemed to dry my face out and cause spots since trying the simple kind refreshing face wash my face has never felt as soft and no signs of dry skin or spots will definitely be buying this face wash [This review was collected as part of a promotion.],False,2019-02-26 06:19:00,294,0
1348,2/24/2019,5,I usually like a moisturising face wash as I have fairly dry skin but this is lovely to use after a long day. Leaves no residue and left my skin feeling really soft. I need to be careful not to use too much as a little can go along way. [This review was collected as part of a promotion.],False,2019-02-24 05:31:00,288,2
1349,3/1/2019,3,"I2019ve been using this daily, the product lathers up nicely with a little water and the bottle is a good size so it2019ll last a long time. I found it quite drying on my skin compared to other facial washes I2019ve used and I don2019t think even the smell was refreshing to me which was a little disappointing [This review was collected as part of a promotion.]",False,2019-03-01 23:54:00,362,1
1350,2/26/2019,5,I2019ve been using this face wash for just over a week now. I2019m really happy with the way it makes my skin feel. It2019s not drying all and has no harsh chemical smells. It lathers up really well and a little goes a long way. It removes my make up well and leaves my skin nice and soft . Great packaging in a easy squeeze tube. [This review was collected as part of a promotion.],False,2019-02-26 14:50:00,382,2
1351,3/15/2019,5,"I really liked this face wash and I would definitely buy it in the future. My skin reacts well to simple products, my face was glowing when I got out of the shower. I would definitely rocemmend to a friend as well. [This review was collected as part of a promotion.]",False,2019-03-15 18:13:00,266,0
1352,2/26/2019,5,This is something I've never tried before and I've now been using it daily and my skin in looking and feeling better. It has a very delicate smell and is easy on the skin and is all goodness I absolutely love this x [This review was collected as part of a promotion.],False,2019-02-26 07:27:00,267,0
1353,3/5/2019,5,This bleach has became a bit of a obsession of mine. living in a very big house 6 bed pool room I use 2 bottles of this each day and I have to say I luv it!!. I always used the pink bleach in the stables aswell but my new favourite has to be the white 1. My maid thought it was for white washing and added it to the whites bedding towels ect and it done the trick there aswell.,False,2019-03-05 07:09:00,377,1
1354,3/10/2019,5,I always used the honey suckle and sandalwood 55 wash bottle and loved the smell of that . But when I was in Asda yesterday I smelt this one and wow can honestly say I will be making a permanent change to this one its beautiful cherry blossom and sweet pea such beautiful smells I just wish you would sell the bigger size bottle of this the 55washes one like you do in the honey suckle and sandal wood one can you start selling the 55 wash in this one please? Thanks,False,2019-03-10 07:47:00,467,2
1355,3/3/2019,5,"This is one of the nicest smelling fabric conditioners I have smelt ever. My clothes always have a beautiful scent after using and I just cant get enough of it, mmmm! Please dont stop making this Comfort people!",False,2019-03-03 12:01:00,213,3
1356,2/27/2019,4,Bought this when down in price. Smells in tub. Cleans good on a 30 wash. Only reason why I won't buy again clothes don't smell like they do when you put them in.,False,2019-02-27 06:25:00,161,0
1357,2/23/2019,5,"I've been using this product for a few days now and I have to say that is really kind to skin.It doesn't had a bad smell,my skin feels so smooth and soft after using it.I truly recommend this product to everyone. [This review was collected as part of a promotion.]",False,2019-02-23 12:49:00,264,0
1358,3/14/2019,5,"I've been using this remover for years. It's not scented, not greasy & doesn't irritate the eye area even when removing stubborn mascara. Fantastic value too.",False,2019-03-14 04:30:00,158,2
1359,2/23/2019,5,"So I have a oily combination skin type and I am forever getting spots and blackheads in my t-zone because of this, especially over my nose. Being fed up with it all I started to cleanse, tone and moisturise. This toner is by far the best one I have ever used. It smells amazing. It doesn't irritate my skin like some other brands I've tried do (despite not having sensitive skin) and my blackheads and spots are clearing up. My oily t-zone isn't so much of a problem anymore. Definitely getting this from now on and recommending to anyone that has similar issues to me [This review was collected as part of a promotion.]",False,2019-02-23 04:49:00,620,0
1360,3/1/2019,5,I have eczema and acne rosacea on my face and I use this coz have very dry skin and other products sting my face and make it worse where as this it makes my skin nice and soft and is very effective and helps my eczema too.,False,2019-03-01 15:17:00,222,1
1361,3/1/2019,3,"I've been using this daily, the product lathers up nicely with a little water and the bottle is a good size so it'll last a long time. I found it quite drying on my skin compared to other facial washes I've used and I don't think even the smell was refreshing to me which was a little disappointing [This review was collected as part of a promotion.]",False,2019-03-01 00:53:00,350,1
1362,3/2/2019,5,"Suffering from mild Ezyema, my skin has always been sensitive and dry so i'm very careful when using skincare products preferring brands who use no nasties. I've been a fan of Simple for a while now, using their moisturisers and face wipes and have just switched to using their Kind to Skin face wash. 3 weeks in and i've noticed my skin is more radiant and less dry than it has been, with my face left feeling clean and fresh after each wash. It's light, refreshing, non perfumed and best of all kind to skin but still cleansing. A great every day mild cleanser that you can introduce to your skin care regime. A great product at a very affordable price range. [This review was collected as part of a promotion.]",False,2019-03-02 06:34:00,713,1
1363,2/24/2019,5,I usually like a moisturising face wash as I have fairly dry skin but this is lovely to use after a long day. Leaves no residue and left my skin feeling really soft. I need to be careful not to use too much as a little can go along way. [This review was collected as part of a promotion.],False,2019-02-24 06:14:00,288,1
1364,3/2/2019,4,"Having sensitive skin it's usually difficult to find a facial wash that is effective, refreshing, gentle and doesn't dry out my skin. This ticked all those boxes and my skin was left feeling clean and fresh. I will definitely be buying this Simple product again. [This review was collected as part of a promotion.]",False,2019-03-02 07:07:00,314,3
1365,3/13/2019,4,"I really like this product, I use it in my double cleansing routine, after using oil to remove my makeup, this product helps removing all the rest. I feel that it really respect my acne prone skin and leaves it fresh and smooth. [This review was collected as part of a promotion.]",False,2019-03-13 23:50:00,280,0
1366,2/25/2019,5,"This product is really surprising! It leaves my face looking and feeling so smooth, soft and fresh! Its a really gentle product and feels amazing when being massaged into wet skin. It rinses off without leaving and any residue and is fantastic value for money! I would certainly recommend this product as part of your every day skin care routine. [This review was collected as part of a promotion.]",False,2019-02-25 01:03:00,398,4
1367,2/26/2019,5,I use to use shops own brand face wash which seemed to dry my face out and cause spots since trying the simple kind refreshing face wash my face has never felt as soft and no signs of dry skin or spots will definitely be buying this face wash [This review was collected as part of a promotion.],False,2019-02-26 00:41:00,294,0
1368,2/26/2019,5,I've been using this face wash for just over a week now. I'm really happy with the way it makes my skin feel. It's not drying all and has no harsh chemical smells. It lathers up really well and a little goes a long way. It removes my make up well and leaves my skin nice and soft . Great packaging in a easy squeeze tube. [This review was collected as part of a promotion.],False,2019-02-26 04:23:00,373,0
1369,3/19/2019,4,"I bought this a few months ago due to the fact that I love Simple skincare products and was looking for a drugstore face wash that didn't have lots of nasties. This is the perfect gentle face wash after I take my makeup off, leaved my skin feeling very soft and clean, followed by Simple moisturiser and it's a no brainer. [This review was collected as part of a promotion.]",False,2019-03-19 13:55:00,374,4
1370,2/26/2019,5,This is something I've never tried before and I've now been using it daily and my skin in looking and feeling better. It has a very delicate smell and is easy on the skin and is all goodness I absolutely love this x [This review was collected as part of a promotion.],False,2019-02-26 05:14:00,267,0
1371,3/15/2019,5,"I really liked this face wash and I would definitely buy it in the future. My skin reacts well to simple products, my face was glowing when I got out of the shower. I would definitely rocemmend to a friend as well. [This review was collected as part of a promotion.]",False,2019-03-15 16:13:00,266,2
