,review_date,review_rating,review_text,verified_purchase,review_time,review_textlength,helpful_review
1819,4/18/2019,5,"I have thick hair and have difficulty finding a product that will hold without falling flat. Applying these to dry hair I've found using a moderate amount of the clay my hair will hold and have the right shine. The product is cheap, smells good and does the job, I definitely recommend it.",True,2019-04-18 07:30:00,289,1
1820,4/3/2019,5,Fab,True,2019-04-03 15:07:00,3,4
1821,4/3/2019,5,Great price,True,2019-04-03 07:59:00,11,2
1822,4/3/2019,5,Good for the money I get more for that money,True,2019-04-03 17:33:00,44,4
1823,4/3/2019,5,Smells great and good price if you can get for £6,True,2019-04-03 06:40:00,49,3
1824,4/4/2019,5,I use these all the time have tried others but there are a winner,False,2019-04-04 22:29:00,65,3
1825,4/4/2019,1,"Its just too sweet to eat: caramel, marshmallow, chocolate, etc, look at them. Its literally a calorie bomb!!! And the ingredients just melting together, too sweet and gross. Im gonna throw up after eating this.",False,2019-04-04 23:18:00,211,3
1826,4/4/2019,5,A+,True,2019-04-04 16:49:00,2,0
1827,4/4/2019,5,Love the smell and leaves my hair feeling great after styling,True,2019-04-04 02:05:00,61,1
1828,4/4/2019,5,Not my cup of tea but the old man loves them so they have to be a 5* because he has at least 2 every week at lunch time. They make a nice convenient lunch and he likes the flavour. We have gone back to the normal size one's. There is less difference between them than one might imagine and they King is usually much more expensive. These are 90g the King 114 grams.,False,2019-04-04 23:53:00,365,3
1829,4/4/2019,5,A+,True,2019-04-04 15:45:00,2,4
1830,4/4/2019,5,Neatly packaged and quick delivery. I like everything about my item. Thank you,True,2019-04-04 08:20:00,78,3
1831,5/4/2019,4,This is one my favourite scents however I\u2019ve recently noticed that the conditioner is no longer pink in colour and the scent has dramatically changed.. can someone please explain.. disappointing,False,2019-05-04 04:23:00,199,4
1832,5/4/2019,5,amazing!cant rate it enough got it as a gift and can\u2019t stop smelling it the scent is absolutely amazing the exfoliate itself is amazing my skin after the use feels so soft just can\u2019t stop using it!wont use any other skin brand!x,False,2019-05-04 22:46:00,238,3
1833,4/5/2019,5,Im very happy with this purchase. Would definitely recommend for my friends and family,False,2019-04-05 19:48:00,86,0
1834,4/5/2019,1,"Awful product, no hold, leaves hair flat and greasy, doesn't dry.",False,2019-04-05 03:54:00,65,0
1835,4/5/2019,1,"I bought this to wash my clothes, however! You need a washing machine as well! Should say so in the description",True,2019-04-05 21:44:00,111,4
1836,4/5/2019,4,Despite using sure for years he does not like this one.,True,2019-04-05 04:02:00,55,2
1837,4/5/2019,5,Beautiful smell and love how it the scent lasts for ages!,True,2019-04-05 10:01:00,57,4
1838,4/6/2019,5,Really impressed with this product. Smells so nice and clothes smell fresh weeks after being washed.,True,2019-04-06 12:56:00,100,2
1839,4/5/2019,5,fast delivery Good value for money,True,2019-04-05 04:57:00,34,0
1840,4/5/2019,5,great great will buy again,True,2019-04-05 03:27:00,26,4
1841,4/6/2019,5,"I suffer from dry skin on various parts of my face, and I have tried many other products, but nothing ever seemed to work. My make-up would sit horribly on my face, it looked blotchy due to the dryness. I found this and decided to give it a go, and it was the best decision I have made. I have only been using it a few weeks, but already there has been great improvement in my skin. My skin feels so refreshed! I would definitely reccommend this product!",False,2019-04-06 09:26:00,454,0
1842,4/6/2019,2,Good product that I have used before Came in wrapping all around but one leaked,True,2019-04-06 08:44:00,79,0
1843,4/6/2019,5,Smells lovely and fresh,True,2019-04-06 06:16:00,23,4
1844,4/7/2019,5,"This stuff is absolutely amazing. I have been using it for about three weeks and it has completely transformed my skin. It2019s made it so soft, hydrated and smooth. I used to always struggle with the skin on and around my nose, it was always very dry and extremely dehydrated no matter what I tried and this is the only cream that has completely sorted them issues out. My make up now sits so nicely over my nose and the rest of my skin too. I purchased this sleeping cream and also the day version but I much prefer using this one day and night as the night one is that little bit more moisturising!",False,2019-04-07 10:46:00,601,0
1845,4/7/2019,5,For my hair,True,2019-04-07 06:04:00,11,4
1846,4/7/2019,5,Good,True,2019-04-07 05:43:00,4,2
1847,4/7/2019,5,"Ive got mrs hinch to thank for the reason that I tried this and wow Im glad I did. This with a non scratch scouring pad (or the Minky sponge) leaves me oven, hob, taps and sink and also my shower screen gleaming!! Amazing",True,2019-04-07 08:39:00,223,2
1848,4/7/2019,5,"Like most people I always forget to leave positive feedback, but always quick to leave negative feedback. This time I make a point! Item as described. Very happy with the service, thank you very much.",True,2019-04-07 10:49:00,200,4
1849,4/7/2019,5,"Great value when compares to what you get charged at the supermarket. Softens clothes, is kind on the skin and the fragrance isn't overbearing like some fabric conditioners.",True,2019-04-07 07:26:00,173,0
1850,4/7/2019,5,We only use comfort in our house to Buy this bigger one on a regular basis when on special,True,2019-04-07 20:15:00,90,1
1851,4/7/2019,4,4 stars purely because it leaves a smear on my white kitchen tiles but it does clean them well,False,2019-04-07 02:35:00,94,0
1852,4/7/2019,5,I've used other heat protection products and they've left my hair sticky or greasy. I love this spray!! Love how soft my hair feels after using it too.,True,2019-04-07 13:03:00,151,3
1853,5/1/2019,1,a little confused why so many people are saying these are vegan when the ingredients say these MAY contain milk. May?! what's that about? if the makers of these do not know who does? really disappointing for those who cannot take that risk,False,2019-05-01 23:15:00,239,0
1854,4/8/2019,5,"I used this in Gran Canaria in 25\u00B0C heat and it protected my face from 8am until 5pm, when i washed it off. It isn't greasy at all and dries with in minutes. Doesn't leave a shiny look and feels like it's moisturising whilst protecting the skin at the same time! I used it every day for 2 weeks and there isn't still loads left in the bottle. Would recommend to anyone!!!! Amazing.",False,2019-04-08 16:44:00,386,0
1855,4/8/2019,2,"I've used this product for years and it's always worked well. I recently bought it and it had a new fragrance, which wasn't made obvious and I didn't really like. It doesn't offer me the same sweat protection. Had I known I wouldn't have bought it",False,2019-04-08 17:38:00,247,0
1856,4/8/2019,1,"I have no idea how well it tans as yet. I am writing this at 4am, I put it on after my shower yesterday evening and the stink has woken me up and given me an absolutely horrific headache. Desperate to wash it off but I'm afraid of disturbing the kids. Cheers Dove!!",False,2019-04-08 11:59:00,265,0
1857,4/8/2019,2,"I've used this product for years and it's always worked well. I recently bought it and it had a new fragrance, which wasn't made obvious and I didn't really like. It doesn't offer me the same sweat protection. Had I known I wouldn't have bought it",False,2019-04-08 00:31:00,247,1
1858,4/8/2019,2,"I've used this product for years and it's always worked well. I recently bought it and it had a new fragrance, which wasn't made obvious and I didn't really like. It doesn't offer me the same sweat protection. Had I known I wouldn't have bought it",False,2019-04-08 07:48:00,247,0
1859,4/8/2019,5,"Lovely smell. Softens clothes. The whole range of Comfort is good. However, I think we all use too much product. The fragrance is strong and the consistency of the conditioner is reasonably thick.I now use half as much as I previously used. One third to half a cap is quite enough for a full wash load to soften and produce amazing scent. And softens clothes admirably. We don't need an overpowering blast of perfume, a subtle whiff is lovely. By using less, we are doing our small bit to save the planet through pollution. We are also saving money as I've noticed that a bottle of softener lasts twice as long. Its a win win!",False,2019-04-08 23:22:00,626,0
1860,4/8/2019,5,Best mayo. What else,True,2019-04-08 15:18:00,20,0
1861,4/8/2019,5,What can you say but it's makes your clothes smell nice,True,2019-04-08 06:56:00,55,2
1862,4/6/2019,5,Fit for purpose,True,2019-04-06 04:17:00,15,2
1863,4/8/2019,5,Good,True,2019-04-08 18:45:00,4,1
1864,4/8/2019,5,Good washing capsules.The smell is very nice.,True,2019-04-08 06:46:00,45,0
1865,4/7/2019,5,Better than most similar products and second to none.,True,2019-04-07 04:56:00,53,4
1866,4/7/2019,5,Easy to use great value on subscription,True,2019-04-07 20:54:00,39,5
1867,4/6/2019,5,Love this washing powder,True,2019-04-06 08:56:00,24,0
1868,4/8/2019,5,"Does what it says on the label, washes well",True,2019-04-08 00:54:00,43,2
1869,4/7/2019,5,Easy to use great value on subscription,True,2019-04-07 14:00:00,39,2
1870,4/6/2019,5,Love this washing powder,True,2019-04-06 23:00:00,24,2
1871,4/8/2019,5,Good washing capsules.The smell is very nice.,True,2019-04-08 17:48:00,45,2
1872,4/8/2019,5,"Does what it says on the label, washes well",True,2019-04-08 06:18:00,43,0
1873,4/7/2019,5,Better than most similar products and second to none.,True,2019-04-07 00:23:00,53,4
1874,4/8/2019,5,Good washing capsules.The smell is very nice.,True,2019-04-08 19:22:00,45,0
1875,4/8/2019,5,"Does what it says on the label, washes well",True,2019-04-08 14:23:00,43,2
1876,4/7/2019,5,Better than most similar products and second to none.,True,2019-04-07 02:22:00,53,3
1877,4/7/2019,5,Easy to use great value on subscription,True,2019-04-07 04:05:00,39,0
1878,4/6/2019,5,Love this washing powder,True,2019-04-06 11:43:00,24,1
1879,4/8/2019,5,Good washing capsules.The smell is very nice.,True,2019-04-08 03:09:00,45,2
1880,4/7/2019,5,Easy to use great value on subscription,True,2019-04-07 05:25:00,39,0
1881,4/6/2019,5,Love this washing powder,True,2019-04-06 04:16:00,24,5
1882,4/8/2019,5,"Does what it says on the label, washes well",True,2019-04-08 13:12:00,43,0
1883,4/7/2019,5,Better than most similar products and second to none.,True,2019-04-07 03:43:00,53,1
1884,4/8/2019,5,great price love this Fabric Conditioner,True,2019-04-08 06:29:00,40,1
1885,4/7/2019,5,Quick postage and great product,True,2019-04-07 06:52:00,31,0
1886,4/7/2019,5,I don't smell anymore,True,2019-04-07 08:07:00,21,2
1887,4/6/2019,2,Good product that I have used before Came in wrapping all around but one leaked,True,2019-04-06 12:27:00,79,0
1888,4/6/2019,5,"Smells beautiful, fragrance lasts for weeks after washing. Great value, Ive subscribed to this product.",True,2019-04-06 06:47:00,104,5
1889,4/7/2019,5,"Like most people I always forget to leave positive feedback, but always quick to leave negative feedback. This time I make a point! Item as described. Very happy with the service, thank you very much.",True,2019-04-07 14:27:00,200,5
1890,4/9/2019,1,Binned It.,False,2019-04-09 02:57:00,10,3
1891,4/23/2019,5,About two weeks after using this my bad cystic acne started to fade by the time i finished the bottle all my acne was gone.i thought i was just missing toner in my skin care so i started using a garnier one i had from a set .One week later my acne comes back so im back to using simple and my acne is fading again.i will never stop using this,False,2019-04-23 04:32:00,342,1
1892,5/8/2019,1,"I bought this a couple of months ago along with the cleanser and moisturiser as i have spot prone, oily skin and occasional issues with dermatitis around my eyes. This was the worst mistake ever. I thought I was crazy as Simple is supposed to be gentle on the skin but after using this toner it has dried my skin out and bought the dermatitis back around my eyes so they are very red, the skin flaky and sore in places. At first i didn't think it was the toner but after two months of elimination it is definitely the toner drying out my skin. I would not recommend this product at all.",False,2019-05-08 20:15:00,586,1
1893,4/9/2019,2,I'm a diabetic and wanted to find out the carbohydrate content. I could not find ANY nutritional information whatsoever. Badly managed Walls...,False,2019-04-09 04:25:00,143,2
1894,4/9/2019,5,"My girls are so picky about what they wash and condition their hair with and they go through a tonne of the stuff with being teens. So I thought I would try this. Excellent price. Well they were delighted with the results. Soft, stinky , silky and smooth hair. One has chemically treated hair as well. This lead me to have a try as mine is bleached and toned. Wow. I spend a fortune on shampoos and conditioners. Well you think you need to when you do on your hair. Not any more. This is great. I have it on subscribe and save feature now and saving us by not buying over priced products.",True,2019-04-09 00:55:00,588,0
1895,4/9/2019,5,The smell in clothes is so lovely and it last long.you dont have to use a lot aswell.would definately buy again and recommend to others.,False,2019-04-09 09:06:00,136,1
1896,4/9/2019,5,I normally buy my washing detergents in shops as I like to see whats on offer etc... I had run out of washing liquid and fabric conditioner and wasnt able to get to the shops due to a broken ankle. I came across this bundle as decided to give it a try as I as desperate for washing stuff. This bundle is a brilliant buy and very good value for money. I would highly recommend. However the fabric conditioner did seem to clog up the drawer though - this has never happened with the normal fabric conditioner I use.,True,2019-04-09 09:54:00,515,0
1897,4/9/2019,5,"My girls are so picky about what they wash and condition their hair with and they go through a tonne of the stuff with being teens. So I thought I would try this. Excellent price. Well they were delighted with the results. Soft, stinky , silky and smooth hair. One has chemically treated hair as well. This lead me to have a try as mine is bleached and toned. Wow. I spend a fortune on shampoos and conditioners. Well you think you need to when you do on your hair. Not any more. This is great. I have it on subscribe and save feature now and saving us by not buying over priced products.",True,2019-04-09 08:14:00,588,1
1898,4/9/2019,5,"Love this specific version from Comfort. Really subtle and gentle smell that does not overpower the clothes, but you still know it is there.",True,2019-04-09 02:00:00,140,5
1899,4/9/2019,5,"I have been converted to these by my friend. Tried a few times and cannot live without them now. Really fresh, yet mild smell to the clothes. Nicely removes all the stains of a messy 6 year old too!",True,2019-04-09 05:45:00,198,2
1900,4/9/2019,5,"I have been converted to these by my friend. Tried a few times and cannot live without them now. Really fresh, yet mild smell to the clothes. Nicely removes all the stains of a messy 6 year old too!",True,2019-04-09 01:52:00,198,4
1901,4/9/2019,5,"I have been converted to these by my friend. Tried a few times and cannot live without them now. Really fresh, yet mild smell to the clothes. Nicely removes all the stains of a messy 6 year old too!",True,2019-04-09 06:11:00,198,4
1902,4/9/2019,5,"I have been converted to these by my friend. Tried a few times and cannot live without them now. Really fresh, yet mild smell to the clothes. Nicely removes all the stains of a messy 6 year old too!",True,2019-04-09 11:38:00,198,4
1903,4/9/2019,5,"Fantastic value, ordered Sunday was delivered Monday..thanks so much!",True,2019-04-09 05:11:00,69,2
1904,4/9/2019,5,smell good and make my clothes more soft,True,2019-04-09 04:15:00,40,2
1905,4/30/2019,3,"Lotion works pretty good however 8 pumps into a 20.3 oz bottle and the 201Csmart pump201D stopped working. They2019ve designed the bottle so that you can2019t screw the pump off, like we2019ve all done in the past to get the last of the lotion out. I was determined to not loose a entire bottle of lotion so I had to cut the top off with a box knife. Word to the wise, advoid the smart pump!",False,2019-04-30 14:22:00,391,1
1906,4/14/2019,2,The pump design on the large bottle is horrible. It is impossible to determine which end the lotion will come out by looking at the pump. How many carpets and pieces of furniture are being ruined by the pump design.,False,2019-04-14 02:08:00,215,0
1907,4/25/2019,2,"I can't believe you can't unscrew the top to get to the last of the lotion! I have 2\"" of lotion in the bottle that I can't get to! What a waste of money. Will be switching body lotions with my next purchase.",False,2019-04-25 03:19:00,208,0
1908,4/10/2019,5,good,False,2019-04-10 05:33:00,4,1
1909,4/10/2019,4,"Great soap, always lovely",True,2019-04-10 06:08:00,25,1
1910,4/19/2019,5,"my daughter had allergies, she could not stand this one",True,2019-04-19 10:11:00,55,2
1911,4/12/2019,5,Great value and works well.,True,2019-04-12 07:54:00,27,4
1912,4/24/2019,5,"Fantastic, Amazon 100% ther",False,2019-04-24 21:43:00,27,0
1913,4/10/2019,5,Great value & delivery - perfect for anyone who does washing on a daily basis like we do - lasts ages and cheaper than buying multiple bottles in the supermarket. Smells lovely to!,True,2019-04-10 11:52:00,180,1
1914,4/10/2019,5,A lot of people are complaining this doesn't have a seal. Neither does the one you buy at Morrisons. These aren't required to have a seal on them. Great price and great product. It works well and smells good. Will be buying again.,True,2019-04-10 18:15:00,230,2
1915,4/10/2019,5,Get these delivered regularly - makes it a lot easier than lugging all the heavy stuff home from the shop. Brilliant !,True,2019-04-10 13:51:00,118,3
1916,4/10/2019,5,Get these delivered regularly - makes it a lot easier than lugging all the heavy stuff home from the shop. Brilliant !,True,2019-04-10 12:36:00,118,4
1917,4/10/2019,5,Get these delivered regularly - makes it a lot easier than lugging all the heavy stuff home from the shop. Brilliant !,True,2019-04-10 13:57:00,118,0
1918,4/10/2019,5,Great price and fast delivery,True,2019-04-10 01:22:00,29,0
1919,4/10/2019,2,"The product delivered to me would not soften properly and tasted inferior to the ones I buy at Tesco. I had to put the pots in the microwave to get the noodles to soften up a little, and then leave them for several minutes. Will not buy again.",True,2019-04-10 07:57:00,243,0
1920,4/10/2019,5,Brilliant,True,2019-04-10 08:26:00,9,0
1921,4/10/2019,2,"The product delivered to me would not soften properly and tasted inferior to the ones I buy at Tesco. I had to put the pots in the microwave to get the noodles to soften up a little, and then leave them for several minutes. Will not buy again.",True,2019-04-10 22:20:00,243,3
1922,4/10/2019,5,Get these delivered regularly - makes it a lot easier than lugging all the heavy stuff home from the shop. Brilliant !,True,2019-04-10 06:41:00,118,4
1923,4/10/2019,2,Not much flavour of praline at all. Very cheap taste and texture ice cream with cheap tasting choc covering. Also it tasted much more like dark chocolate than of milk and I am not really a fan of that.,False,2019-04-10 05:35:00,201,2
1924,4/11/2019,5,Fav love it always use it xxxx makes my hair so soft n smooth,False,2019-04-11 22:37:00,61,0
1925,4/11/2019,5,"So many uses, on buttered toast, in soups and stews, on roast potatoes.... a handy little tip.... when the jar is nearly empty, store the jar on its side, (there is a little flat bit on the side of the jar) and you can get that last bit out easily.",False,2019-04-11 13:33:00,248,0
1926,4/11/2019,5,Love love love love this flavour. This is one of my favourites. Nice and spicy.,False,2019-04-11 18:43:00,79,2
1927,4/11/2019,5,I love this. It cleans and exfoliates beautifully without leaving my skin red and sore like some do. And it feels supersoft and refreshed. Used twice a week it keeps my skin looking and feeling clean and fresh.,False,2019-04-11 00:02:00,210,0
1928,4/11/2019,5,Value. Great for everyday use.,True,2019-04-11 05:01:00,30,4
1929,4/11/2019,5,I have been using this deodorant for years and find its incredibly effective and long lasting! The only one I use.,True,2019-04-11 13:04:00,115,2
1930,4/11/2019,5,It's shampoo. It's cheaper than in the shops. What more is there to say? XD,True,2019-04-11 11:57:00,75,1
1931,4/11/2019,4,These are not as strong as I expected but they are pleasant enough. I really expected them to be really hot but they are what I would call ''very mild''.,True,2019-04-11 21:29:00,153,3
1932,4/11/2019,5,I have been using this deodorant for years and find its incredibly effective and long lasting! The only one I use.,True,2019-04-11 00:29:00,115,5
1933,4/11/2019,5,It's shampoo. It's cheaper than in the shops. What more is there to say? XD,True,2019-04-11 06:01:00,75,2
1934,4/12/2019,5,Lovely shampoo.,True,2019-04-12 07:59:00,15,4
1935,4/11/2019,5,Value. Great for everyday use.,True,2019-04-11 21:44:00,30,1
1936,4/11/2019,4,This is a decent size bottle of washing liquid and the price isnt too bad as Amazon had it on offer. I have used it before and am happy with its performance.,False,2019-04-11 23:06:00,158,0
1937,4/11/2019,5,"Love this particular surf smell it leaves my washing smelling so fresh, its also a great price for how much you get.",False,2019-04-11 04:02:00,116,0
1938,4/12/2019,5,"Love this, bought for my daughter as nothing else seemed to work to keep her fresh through the day. This does !! The smell is fresh and clean and lasts her all day.",True,2019-04-12 07:33:00,164,2
1939,4/12/2019,5,Fast delivery true to description,True,2019-04-12 23:55:00,33,2
1940,4/12/2019,5,Lovely shampoo.,True,2019-04-12 06:31:00,15,3
1941,4/12/2019,5,Fast delivery true to description,True,2019-04-12 06:41:00,33,2
1942,4/12/2019,5,"I don't buy any other softener! The smell is phenomenal - lasts for ages after a wash. The softness is great and the bottle is so pretty, with an extremely functional measuring cap. Love it!",True,2019-04-12 02:36:00,190,1
1943,4/12/2019,5,Brillant get moneys worth last a while,True,2019-04-12 07:59:00,38,1
1944,4/12/2019,5,This brand you can't go wrong with for your washing.,True,2019-04-12 21:16:00,52,3
1945,4/12/2019,5,"Love this, bought for my daughter as nothing else seemed to work to keep her fresh through the day. This does !! The smell is fresh and clean and lasts her all day.",True,2019-04-12 05:09:00,164,2
1946,4/12/2019,5,A*****,True,2019-04-12 06:49:00,6,5
1947,4/12/2019,5,I liked I could buy in bulk for cheaper price,False,2019-04-12 11:12:00,45,1
1948,4/13/2019,5,These are great - better than normal dairy.,False,2019-04-13 03:05:00,43,0
1949,4/13/2019,5,Brilliant,True,2019-04-13 11:05:00,9,3
1950,4/13/2019,5,Brilliant,True,2019-04-13 21:31:00,9,4
1951,4/24/2019,5,"My wife has extremely sensitive skin, which I never believed until I inadvertently washed some of her clothing in a different detergent. On that basis, she has used either Persil or Fairy products for our joint laundry for many years. Combine that with the fact that we cannot use biological products as we have a septic tank, this product is ideal. The detergent is dispensed into a capsule which is inserted into the main body of the product and then placed on top of the laundry. There is sufficient detergent for 48 washes from the two bottles. The detergent is complimented by a fabric conditioner, which is measured out into the fabric compartment softener on the washing machine; there is sufficient to condition 24 washes. Both products have a pleasant ""clean"" fragrance and leave clothing smelling fresh and soft after drying. A really good product for those with sensitive skin and competitively priced against normal supermarket prices.",False,2019-04-24 08:55:00,947,4
1952,4/13/2019,5,Just as ordered great value arrived as stated good service,True,2019-04-13 05:31:00,58,4
1953,4/14/2019,5,"Lasts all day and has that amazing lynx Africa smell, use this all the time now.",True,2019-04-14 13:20:00,80,4
1954,4/14/2019,5,Leaves a nice streak free clean and shine and smells fresh.,True,2019-04-14 00:32:00,59,1
1955,4/14/2019,1,I purchased this product recently and there is smell and consistency as used to be. I am sure the product was diluted. I guess this water with a bit of a blue pigment. I am very disappointed with a quality of it.,True,2019-04-14 23:16:00,212,1
1956,4/14/2019,5,"Lasts all day and has that amazing lynx Africa smell, use this all the time now.",True,2019-04-14 13:28:00,80,3
1957,4/14/2019,4,Decent softener. Its a bit hard to make it last as long as the listed number of washes,True,2019-04-14 12:11:00,87,2
1958,4/14/2019,5,"Comfort Creations are the best all round fabric conditioner/softener on the market, although a few come close this product can't be matched for scent, softness and value for money. The Honeysuckle & Sandalwood is my personal favourite, however all 6 scents would have the same description as above.",True,2019-04-14 09:07:00,298,3
1959,4/14/2019,4,Good bargin,True,2019-04-14 07:40:00,11,0
